{
  "schemaVersion": "4.0.0",
  "id": "scholarly-pdf-reconstruction-runtime-governance-2026-07-v4",
  "privacy": "public-identities-hashes-runtime-governance-no-source-content-or-local-paths",
  "extends": {
    "id": "scholarly-pdf-reconstruction-eval-governance-2026-07-v1",
    "path": "benchmarks/pdf/reconstruction-eval-contract-v1.json",
    "fileSha256": "a9710abfd82f9ae9e301ed04752e877b3425d98a3f6e8a02649bc0a150068e3f"
  },
  "runtimeBinding": {
    "id": "profile-artifact-validity",
    "status": "available",
    "kind": "code",
    "implementation": "tools/pdf-private-fidelity.mjs",
    "implementationSha256": "a06ef61f3160d85e0e16c3d0498396677870c0a9c5ca1b5cb4e8a8525cac3bca",
    "implementationComponents": [
      {
        "path": "src/research/composition.ts",
        "fileSha256": "86d0d8e34d78c0079ce82c9d22ec6889f537a705cd86e6b7926795f887aef69a"
      },
      {
        "path": "src/research/decision-record.ts",
        "fileSha256": "145f4ae76deb82d4f54b34d7bc2c8d61e973bca9529d79ae924481869c0ccbc3"
      },
      {
        "path": "src/research/diagnostic-overlays.ts",
        "fileSha256": "bfb46b9417d7405256ce5842f2ee244d04c5067163085aa79aa1189d4867496a"
      },
      {
        "path": "src/research/epub.ts",
        "fileSha256": "7fb5e2727073d06e84aa856d5d4710a1f6b92b8588edf92f3d2ca45c66c1db05"
      },
      {
        "path": "src/research/equation-geometry-transcript.ts",
        "fileSha256": "e75e5405a44d318745d600096760ba96e9d1fc62448f9adc1e4d0d906e1bcd67"
      },
      {
        "path": "src/research/equation-render-only-ownership.ts",
        "fileSha256": "484d4785061ec8b6b64ecd0c7790b5c4785386e8f8465948cf9a167a94417ede"
      },
      {
        "path": "src/research/equation-transcript-adjudication.ts",
        "fileSha256": "288b4f44c7be16a01ecfac98ec3002c9ed2489dcb826a5b1ca26459eafcc7872"
      },
      {
        "path": "src/research/import-types.ts",
        "fileSha256": "05af6dc3c35667ae690c3d56f1a5309ca02b08c7e36fce7f97867de4f44c7889"
      },
      {
        "path": "src/research/lexicons/en-US/scowl-2020.12.07.aff",
        "fileSha256": "70fe5778717d097ce2f3326baaa5c1e4d2206d81a5a81d3ea8e11c4770806dd5"
      },
      {
        "path": "src/research/lexicons/en-US/scowl-2020.12.07.dic",
        "fileSha256": "829a043cf078d1e80e886289a13823454977f442a239a859d2133ea61944aa60"
      },
      {
        "path": "src/research/lexicons/en-US/ushyphmax-2005-05-30.tex",
        "fileSha256": "f4ffcd96c5cbc886bdad23f95dcae8edc3cd3620eae62f7946eceda97c4e68f8"
      },
      {
        "path": "src/research/model-consultation-binding.ts",
        "fileSha256": "02db98e266299f7374c4c410d4f1976e63f73e07b42ff40fefaa01d426125809"
      },
      {
        "path": "src/research/model-fallback-pipeline.ts",
        "fileSha256": "42d64296aff060585b446f454874d33ee03d8d1b067f7af69ba0532ebbaf94a1"
      },
      {
        "path": "src/research/model-fallback.ts",
        "fileSha256": "a53803e109f38c762292fbcfaa7eac5270f62a3c4b66ff67a7b290c73e472deb"
      },
      {
        "path": "src/research/note-label.ts",
        "fileSha256": "dfb33653596c042bc6c738b89892fe6c242a671277571bbc6d2bd0d98273b697"
      },
      {
        "path": "src/research/pdf-browser-runtime.ts",
        "fileSha256": "e2917db1f3e4b04b1a1cacb08a4f8567c57ea2f4031851efb95649f8fa090211"
      },
      {
        "path": "src/research/pdf-citation-surface.ts",
        "fileSha256": "c6e355904146eacb85547da211c2a4a3b7d7c6c0ab354d059298f8b718c18566"
      },
      {
        "path": "src/research/pdf-cross-references.ts",
        "fileSha256": "1ef11c0f94ab68b44906c3e2d850b5d7c1a40fe146bee586cc168e8b387406fc"
      },
      {
        "path": "src/research/pdf-font-text.ts",
        "fileSha256": "d63d9558d6d0c727ca7067add70330248b281ed3b168559567301c6b66c5c678"
      },
      {
        "path": "src/research/pdf-hyphenation.ts",
        "fileSha256": "404b786fa9d2a664f9218ed935f6adf690808e20e49f23779c7956d1c5154ed5"
      },
      {
        "path": "src/research/pdf-inline-script-integrity.ts",
        "fileSha256": "4b579172f1e1d5ac4d26b6f800081ef6393854c46664cbaf45e4dcdb8cc755b6"
      },
      {
        "path": "src/research/pdf-language.ts",
        "fileSha256": "39a4963ba146e45f07353593861ff3828eed9f9f4519a4fabde6536e13b0eb51"
      },
      {
        "path": "src/research/pdf-layout.ts",
        "fileSha256": "c6d93ceda15592f679a5953d06571373fd2abf9b1716e80663a0d0b4fa72cc04"
      },
      {
        "path": "src/research/pdf-lines.ts",
        "fileSha256": "a1327a743c2f8218283a89d58222fd8f8aeca3436f5735e5ad097b66b65e3f80"
      },
      {
        "path": "src/research/pdf-links.ts",
        "fileSha256": "92f5493f0430ff2c766129c2e616dfae00d185ea2c411081c9ad6cff9a1c7d32"
      },
      {
        "path": "src/research/pdf-note-classifier.ts",
        "fileSha256": "4088b719905ce33152830174914ac904d71b9df78ef4fd737e7d4cbc0cc41871"
      },
      {
        "path": "src/research/pdf-ocr.ts",
        "fileSha256": "4059736af4289ed7f2f533017171712ad1a09c075efff860b49a147499685afa"
      },
      {
        "path": "src/research/pdf-page-crop.ts",
        "fileSha256": "61763b97ce7f99a0abcfb42680422712f027e8ddca6089d151d768c7a04d58d3"
      },
      {
        "path": "src/research/pdf-quality.ts",
        "fileSha256": "610dbc761c52a638e033164c1eeaa1c25a4fbe4e82461490e0402ddf7af5dcdf"
      },
      {
        "path": "src/research/pdf-regions.ts",
        "fileSha256": "230101d26fa23505c104758fe86e55246893739fe0dc4fcd83c0073c3094237a"
      },
      {
        "path": "src/research/pdf-scholarly-label.ts",
        "fileSha256": "e63075933b2b3d6bedbd37529303e8ae6b2395714fb313d7734ab826675b52ba"
      },
      {
        "path": "src/research/pdf-table-detection.ts",
        "fileSha256": "151b926412aadad1eef6c050e1efc88d079f5402a3cf4735eb47976d59c955e8"
      },
      {
        "path": "src/research/pdf-table-scope.ts",
        "fileSha256": "3614978bc6c2c94313901a0ef928455628b270b03e3004eae8a39b8e8346f490"
      },
      {
        "path": "src/research/pdf-text-paint.ts",
        "fileSha256": "8506ac8b23de1685ea4a6dffcfa40acf8dae7d398747015542e886aec5657585"
      },
      {
        "path": "src/research/pdf-visual-order.ts",
        "fileSha256": "409596ce176170ec555d176aa4f9ef5b1ba618fc57fc62a1651688e564253822"
      },
      {
        "path": "src/research/pdf-visual-validation.ts",
        "fileSha256": "e26a0f95d0a153b4c722b8e25875e92fab04cba880f7dcdb34cd1e020ef55504"
      },
      {
        "path": "src/research/pdf-visuals.ts",
        "fileSha256": "6795b8868e7dd46545e4a7f8461e4b6331e94f5f31c5fc46f32184b1147b4e6c"
      },
      {
        "path": "src/research/pdf.ts",
        "fileSha256": "10fe0941cfaeb9fe0c90ae887eec92ddf4a45ad8be31cc406f6bb917081db6eb"
      },
      {
        "path": "src/research/publication-integrity.ts",
        "fileSha256": "34e799a2649491c13bb4aac0f1cfca730398802342be7e5cc9435a7a0a821fd6"
      },
      {
        "path": "src/research/publication-resource-limits.ts",
        "fileSha256": "6678dbe5f0f76c7c3f25d5f793b0775cc60e250216deabdcb097df2047877788"
      },
      {
        "path": "src/research/semantic-table.ts",
        "fileSha256": "077cecbe518476b9f6aa4f4f45ef7780ec5ced665966b9a7328a883b48f86dfc"
      },
      {
        "path": "src/research/sha256-sync.ts",
        "fileSha256": "096873bf573fa87872c28837ed120ab5560c35ff12b5842b88ce987ca8e891c6"
      },
      {
        "path": "src/research/table-candidate-provider.ts",
        "fileSha256": "b77275b39c699e2a698da1f75b0f72c2531e98f95f801142cde603252bc6977b"
      },
      {
        "path": "src/research/target-schema.ts",
        "fileSha256": "ae501fef726d9f43e9315804e9f9abfaeaec1fd43dbdc04610f2002bdee34aab"
      },
      {
        "path": "src/research/targets.ts",
        "fileSha256": "6475c6c8b979bba1d8f2278fd1a8e62d05cb13ec07798d063fc33d3a3729a183"
      },
      {
        "path": "src/research/visual-assets.ts",
        "fileSha256": "d1c133e6e18ee7313816b3763cd983eb68a522405e09201448c18d5c9fb895b1"
      },
      {
        "path": "src/struct/epub.ts",
        "fileSha256": "cf7c335b45ff1ff7406a19ccab6daa5da7d166e43cd6844cd0febd0c16f56063"
      },
      {
        "path": "src/struct/ids.ts",
        "fileSha256": "fefc2d2408acd7fc9c28167dc505af0933d153d73a58d16f5c14dcaa9a11b2d2"
      },
      {
        "path": "src/struct/model-consultation-receipt.ts",
        "fileSha256": "f46469f8208c9c8e8e4d4d8246140b3c663e2caf6d5c022add8197ca4eed4877"
      },
      {
        "path": "src/struct/sha256.ts",
        "fileSha256": "7c240348df2f60ec53ee870346ab4d1ac2dfff16b8a32b1464b7b875c1c749f4"
      },
      {
        "path": "src/struct/types.ts",
        "fileSha256": "01478f8f0277565d70bfdf9acdc07e97db796d03cb5b3db8d2aaeddbd1434df0"
      },
      {
        "path": "src/struct/xhtml.ts",
        "fileSha256": "de5e69b610131c824cc632b388b0b244f278062ee36bc7f4ac4b8cd5a363cb2b"
      },
      {
        "path": "tools/pdf-corpus-audit-lib.mjs",
        "fileSha256": "3ac86a0e2fd13f611640702efaa1d879088cab83a93c996e7eb814fedb54d411"
      },
      {
        "path": "tools/pdf-corpus-audit-safety.mjs",
        "fileSha256": "7a251a5374cc64bad81add609c60f914f3cb1b736a2771d0af2ad1829fc7cfa5"
      },
      {
        "path": "tools/pdf-ocr-apple-vision.mjs",
        "fileSha256": "14af58e901afc0f1a38396f74f062ceeb7e97f4d5270db067bdd2b5304d9921f"
      },
      {
        "path": "tools/pdf-ocr-engines.mjs",
        "fileSha256": "49c8c0e9190954a29ce614d9d8520a85df01e5747c2aa81f9a94a94e6fe8503f"
      },
      {
        "path": "tools/pdf-ocr-node.mjs",
        "fileSha256": "6700b78b2325b1f3b2764f25764dec600253f0c2bf588bf0011a84eff401eef8"
      },
      {
        "path": "tools/pdf-ocr-remote.mjs",
        "fileSha256": "dc5e0998fd31e194ac27b7c9e117915f27438de2e078f0c09349f0a978d8ad1f"
      },
      {
        "path": "tools/pdf-private-fidelity-epubcheck.mjs",